<?xml version="1.0" encoding="Windows-1252"?>
<xs:schema attributeFormDefault="unqualified" elementFormDefault="qualified" xmlns:xs="http://www.w3.org/2001/XMLSchema">
  <xs:element name="Devices">
    <xs:complexType>
      <xs:sequence>
        <xs:element name="Library" maxOccurs="unbounded">
          <xs:complexType>
            <xs:sequence>
              <xs:element minOccurs="0" maxOccurs="unbounded" name="Part">
                <xs:complexType>
                  <xs:attribute name="Part" type="xs:string" use="required" />
                  <xs:attribute name="Component" type="xs:string" use="required" />
                </xs:complexType>
              </xs:element>
            </xs:sequence>
            <xs:attribute name="Name" type="xs:string" use="required" />
            <xs:attribute name="Component" type="xs:string" use="optional" />
          </xs:complexType>
        </xs:element>
      </xs:sequence>
    </xs:complexType>
  </xs:element>
</xs:schema>